Reviews,Score,Sentiment
worst prof in waterloo engineering,1.0,negative
I still hate hime even though he is not teaching anymore!,1.0,negative
"Singlehandedly ruined the credibility of an entire department. Turned an entire generation of UW comp/elec engineers into the cynical, apathetic group they've become. Now, the department is only starting to salvage itself because of this one man",1.0,negative
"Barby should sit at home and play with Barbie dolls, or sell Barbie dolls. What is he doing teaching waterloo engineers?",1.0,negative
"Worst professor of all engineering departments in the entire North America. Does not care about his students, he thinks it is cool when so many students are doing so poorly, he is an embarrassment to Waterloo Engineering. Hopefully they'd get rid of him",1.0,negative
He's the worst of the worst professors. No prof worse than him can be found in ANY other Waterloo faculty,1.0,negative
I have never seen any intructors thoughout my whole life who hate teaching as much as Barby did.,1.0,negative
A class everyone should take to better themselves. Simply incredible; engaging lectures with tremendous application and relevance. Cares about helping the students better themselves. Standing ovation after every lectures...enough said!,5.0,positive
unequivocally the most deplorable human being I have ever had the misfortune of meeting.,1.0,negative
be glad he's not the work term report coordinator anymore,1.0,negative
WORST PROF THAT EVER TAUGHT ON THE SOIL OF UNIVERSITY OF WATERLOO! Doesn't deserve to be teaching here. VERY SADISTIC AND ENJOYS WATCHING STUDENTS PEFORM POORLY. LOVES TO FAIL WATERLOO GENIUS KIDS!!!!,1.0,negative
No Comments,1.0,negative
"Put into Waterloo to weed people out and increase Waterloo's reputation as a ""difficult school"". Not making people learn and writing hard exams doesn't make Canadians smarter, it just proves that Canadian schools suck.",1.0,negative
One of the worst profs ever at the University of Waterloo. How they heck did they make him the Electrical Engineering Program Coordinator?,1.0,negative
He is the worst prof in uwaterloo. Only 4 people passed the midterm!,1.0,negative
I have yet to hear of a professor as hated and loathsome as this one. Deserves to have his office walled off. AGAIN.,1.0,negative
Even I have graduated several years already.. i think the least thing I remember is from his E&CE 241 course. Basically i learnt nothing from his course. Nothing. Zero. None.,1.0,negative
No Comments,1.0,negative
No Comments,1.0,negative
Fair but stern. He helps keep the UW reputation. We need more people like him.,5.0,positive
The most forgetable experience at UW.,1.0,negative
"Really tough and unecessary checklist. If you're life is miserable, you don't have to drag the rest of us with you.",1.0,negative
"Barby, the butcher of Comp Eng - helpful, but teaches too much too fast",3.5,neutral
Should stay away from teaching.,1.0,negative
No Comments,1.0,negative
This fxxking guy never helps and gives advises to students? Only say no to u,1.0,negative
"Biggest chip on shoulder, graduated from college. Avoid him like the plague.",1.0,negative
"The MOST notorious prof. at UW, and for good reason. Stay AWAY from his class!!",1.0,negative
RUN!,1.0,negative
No Comments,5.0,positive
This guy just likes to fail people !!!,1.0,negative
No Comments,3.0,neutral
No Comments,1.5,negative
He is the nightmare of all!,1.0,negative
"If you ever get thrown into his class, GET OUT!!!",1.0,negative
"ok, not as bad as some of the others i had that term",3.0,neutral
The absolute worst;....nothing can stoop to his level,1.0,negative
He has good knowledge but needs to re-cert himself with the TPPE guidelines.,3.0,neutral
No Comments,2.5,negative
Has an inferiority compex because he went to Ryerson,1.0,negative
No Comments,3.0,neutral
The primary reason why I do not donate to the school as an Alumni.,1.0,negative
Enjoys making students scared and likes to ramble. Also a fashion nightmare,2.0,negative
insanely hard,1.0,negative
"If you want a course that only 4 people passed in the midterm, you got it.",1.0,negative
He's still there? Circuit course in 1993 was terrible!,1.0,negative
I like the cut of his jib. However I'm afraid he's not a very talented teacher,1.0,negative
He makes you feel like you're the dumbest in the class! Not just ECE 241,1.0,negative
Makes learning as fun as sliding down a greased razor blade naked.,1.5,negative
he is an insult to the department and an embarassment to the school,1.0,negative
No Comments,1.0,negative
Why was he born????,2.0,negative
He ruined my engineering experience......no Alumni money will exit my pocket....,2.0,negative
He's finally getting all the recognition that he deserves. Negative ratings?,1.0,negative
ECE students in oppression...,1.0,negative
"He likes to make ppl feel bad, and dumb. He loves giving hard time to everyone.",1.0,negative
arrrggggggg,1.0,negative
Such a blaster!,1.0,negative
you can't talk to. Look me in the eye next time,1.0,negative
Will not give a straight answer to even the simplest question.,1.5,negative
We should do garbage collection more often!,2.0,negative
"In Reality, he is evil incarnate",1.0,negative
"Useless, absolutely useless. The TA (Shahram) ran the show.",1.0,negative
A dangerous creature in the electrical circuit kingdom.,1.0,negative
"If the final is any worse than the midterm, we're dead",1.5,negative
Deeply resents questions that only he can answer. (When he is asked),2.5,negative
No Comments,1.5,negative
Failing Class Average LOL!!! ECE241 F01 Avg was 49.92%,2.0,negative
he probably cries if someone gets over 60%..,1.0,negative
He is ruining my life...he will be the reason I leave school...always sarcastic,1.5,negative
"In ""reality""...",1.5,negative
"""Mutual Dislike"" relationship in his class",1.0,negative
be afraid...be very very afraid,2.0,negative
No Comments,2.0,negative
Suffers from some sort of inferiority complex. Very Bureaucratic.,1.5,negative
"terrible on a regular basis, really watch out for the 4th year project!",2.0,negative
he enjoys making people feel like pieces of crap. wears nice shirts though..lol,1.0,negative
He is very fast... but very clear. One learns to appreciate his speed for labs.,4.0,positive
Should learn to lighten up.,1.0,negative
...if you think he is the devil now... wait till 4th year project...,1.0,negative
Makes learning (and everything else in life) difficult,2.0,negative
He drilled us on engineering ethics but sends out generic email messages...,1.0,negative
No Comments,1.5,negative
Worst prof at his best!@$! This guy should leave the university ASAP!!,1.0,negative
Feedback Opamp Oscillators.... It's easy.. let's put it in the final....,1.0,negative
NC. You might lose a year of your life.,1.0,negative
Anything libelous will be deleted.,2.0,negative
No Comments,3.0,neutral
No Comments,1.5,negative
Barby -- Lord of Destruction,1.0,negative
excellent fashion sense,1.5,negative
This guy needs an attitude correction!,1.0,negative
Actually teaching is not THAT bad...but exams were a different story!,2.5,negative
"Promoted from ""Professor"" to ""Work Report Coordinator""",1.0,negative
Garbage...,1.0,negative
he made tough exams!!!!!,3.0,neutral
worst prof in ece,1.0,negative
Still having nightmares...,2.0,negative
It's hard to imagine anyone who could dislike his students more.,1.5,negative
"Talks alot about the ""real world""...a place I think he has never been.",1.0,negative
Very anal,1.5,negative
"loves bureaucracy, would make a good communist",1.0,negative
Merges with Ed Spike to create an Archon. Power overwhelming! Annihilate!,3.0,neutral
most arogant,1.0,negative
Taught us a lot. Everyone who complains doesn't do the homework.,4.5,positive
hates the students,1.5,negative
ryerson grad and has it out for waterloo students,1.5,negative
Wow - bad prof and person,1.0,negative
Can't teach,1.0,negative
he is a good guy,5.0,positive
Views teaching as a chore.,1.0,negative
A bitter prof out to hurt others,1.5,negative
Thanks a lot for keeping at university for an extra year!!,1.0,negative
No Comments,1.5,negative
Worst prof I've ever had,1.0,negative
