Reviews,Score,Sentiment
"His notes are G.O.O.D!, classes are interesting, fun, funny, funky, f... Just go to his class, and u'll never regret it",4.5,positive
"he is a great prof, he explains concepts really great in class, and the time flys by cause he's funny and knows his stuff! make sure he's your prof!",4.0,positive
Do yourself a favour and make SURE he is your prof if you have the choice. Went to some of the other lectures from other profs and they don't even compare. Bissonnette also gives you LOTS of help (and makes you less stressed) if you need it. Love him!,5.0,positive
Good teacher but don't be fooled by the nice guy persona.,3.0,neutral
"Great prof, really knows his material and his notes are great. Go to class; he's a funny guy and he gives a lot of notes (that are sometimes illegible)!!! Highly recommended",5.0,positive
awesome teacher,5.0,positive
"I thought he was soooo hot! But besides that, an awesome teacher that gave ample examples...but if you ever needed anything from him, I would go ask someone else....",3.5,neutral
"Great teacher, smart guy, but not approachable in the least. If you need extra help from him, prepare to get your head bitten off.",4.0,positive
"I've had him in CHEM121,125,212 (first year chem 1 and 2, and inorganic chem) and he's the best teacher I've ever had. Clear, understanding, hardworking, enjoyable to be taught by, etc.",5.0,positive
"HE'S THE BEST CHEM TEACHER I HAVE EVER MET!i took his lecture from 120 till now.i don't like chem b4, but i like so much now!his notes are really useful for ur test and exam!and he's a smart and handsome prof!^.^",5.0,positive
I started coming to his lectures instead of Chieh's and i thought i was in heaven. THIS PROF IS THE GOD OF CHEMISTRY (and chieh... the devil?!)all the material i covered with bissonnette i know perfectly...,5.0,positive
he's the best chem prof i think...he knows what he's doing...started going to his lectures instead of my own cause he's so easy to understand! his classes are always full!! that's gotta tell you something!,4.5,positive
Great prof. Pulls out the chem humor once and awhile to keep things interesting.,5.0,positive
hes the best man!!!! he makes chemisrty fun!!!!! :),5.0,positive
"He is such a good prof that everyone came to his class to learn. He explains things in such depth because he really wants you to ""appreciate"" chemistry. Helps you understand the content to the fullest extent.",5.0,positive
"Very good teacher, knows eveything and teaches it very thoroughly. His tests were fair and he supplies lots of practise problems.",5.0,positive
"An excellent prof. He knows his stuff and goes through lessons very throughly and clearly. A very fun prof, definately recommended.",5.0,positive
No Comments,1.5,negative
I'm going to have to echo the comment before mine and say that this is one awesome prof!,5.0,positive
hard,2.5,negative
awesome,5.0,positive
"his notes are excellent. once you read them..who cares about the text book. he is understandable in class as well, and really knows his stuff.",4.0,positive
Great teacher...luv his notes and his lectures. Explains concepts amazingly well. Tests are hard.,5.0,positive
"WHOA!! here is one prof who knows what he is talking about. His classes are fun and you don't fall asleep :D which is always a good thing. His jokes are kind of lame, but you get a laugh out of them anyway. keep it up carey!",4.5,positive
:D,5.0,positive
"He's smart AND he's funny. With the quality of his in-class notes, he could write his own textbook!!",5.0,positive
"Awesome prof! This is one of the only classes i don't find myslef falling asleep in. Explains things well, gives examples, and tells plenty of jokes. Best prof i have this term.",4.5,positive
Who else could make chemistry even remotely interesting? exactly. Brilliant and funny. Has been known to tell the occasional sexual joke to shake up friday classes....right on Carey!,5.0,positive
"So honest, intelligent and funny. Tells you not to read the txtbk, but to understand the notes. Very cool.",4.5,positive
"Amazing, energetic prof...can't imagine bearing a 3 hr lecture with anyone but him...makes it really interesting, and livens up the class with lame jokes...",5.0,positive
The greatest chem prof ever! Stellar use of the overheads. A little shy though.,4.5,positive
"Awesome prof, covers every course in a comprehensive way that's easy to follow. Makes a few lame jokes that liven up the class, though that's rarely a problem. (Especially at the frantic pace at which he puts up his notes)",5.0,positive
smart and makes class interesting. could use more profs like him.,5.0,positive
"Excellent lectures. Gives relevant examples, and keeps the class entertained. The polar opposite of Dr. Chieh.",5.0,positive
"Excellent Communication of topics in Inorganic Chemistry, Structure and Bonding. Emphasized the key concepts in areas of Quantum Chemistry, and importance of Consistency between Theoretical Calculations and Empirical Observations, for many applications",5.0,positive
"Great prof, very easy midterms and finals and he can actually make you stay awake in class. Why does everyone think he's shy...????",4.5,positive
"Very good Prof. Makes things easy to understand and gives good examples in class. Does seem a bit shy, but he knows his stuff.",5.0,positive
"Great prof, awesome notes, don't bother with the textbook if you have him... he's really cute with his geeky jokes... but doesnt answer questions probably b/c he's nervous in front of class",5.0,positive
Bissonnette is the best chem prof ever! His notes are great and he explains everything. I also think he's a little shy getting in front of a big group of people cuz he always looks at the top back part of the room! so cute! :),5.0,positive
"the best prof who actually teaches things valuable for the exam, good jokes but clearly a chem geek",5.0,positive
No Comments,4.0,positive
"The best Prof ever, to get a good mark read the sample tests on the web",5.0,positive
i still love chem because of him..,5.0,positive
"Very clear, very effective, all in all -- great. Highly recommended.",5.0,positive
"Alright prof, but boring. Tries to be funny. Key word: tries.",2.5,negative
His courses are harder than the seem. One of the more pleasant profs though,4.0,positive
Expects a lot but will help you get there,4.5,positive
"I dunno him. He's my roommate's prof, but I want in NOW!!!!!!",4.0,positive
Bissonnett is the worlds greatest prof.,5.0,positive
"Great teacher, but when you get out of the course you have learned nothing.",5.0,positive
"Best teacher yet... The Machine , 4/5....",5.0,positive
"way better than all the chemistry profs. (he should teach spec, organic, and bio",5.0,positive
awesome teacher!!!,5.0,positive
An amazing and sexy prof.!!,4.5,positive
he's sooooooooooo sweet n sexy.......,4.5,positive
Great prof.,5.0,positive
cute and has a sexy voice,4.0,positive
excellent prof even though he thinks he's montel jorden the talkshow host,4.0,positive
I wish I got 100% on his exam!,5.0,positive
"Care bear is definitely the sexiest prof ever, I also like his trike!",4.5,positive
Excellent teacher!,5.0,positive
he is an awesome teacher and makes things SOOOO clear!!!,5.0,positive
He is clearly the best prof I ever had.,5.0,positive
Good proff and when he tries to be funny he usually is unlike most proffs.,4.5,positive
oh yeah... he is definitly cute!! :),5.0,positive
He is the best chemistry prof I have ever had! He is helpful and inspiring.,5.0,positive
"really nice guy, sometimes sarcastic but someone who cares",5.0,positive
He makes chem much better,4.5,positive
The most amazing prof I've ever had! He makes Chem an enjoyable class!,5.0,positive
"""now you apply the ass backwards"" hihi, that's funny :)",3.0,neutral
"With a prof this sexy, I'm definitely feelin' the chemistry",5.0,positive
"""you can convince yourself fairly readily"" that he is an excellent professor",5.0,positive
check your ass .... famous quotes from bissonnette,4.5,positive
khaki and red shirt look really sexy on Friday mornings. I just love chemistry!!,5.0,positive
Excellent Professor! I never thought of electrochem in terms of ORGIES before!!,5.0,positive
One of the best profs that I have ever had.,5.0,positive
One of the best professors i have had. Makes learning fun!,5.0,positive
Marry me!!,5.0,positive
"Funny, hot, interesting, smart... yup, he's perfect",5.0,positive
awesome professor,5.0,positive
"Great Prof, Down to Earth, Insightful, Understanding",5.0,positive
Bissonnette is the man. Best proff I've had. He's funny too.,4.5,positive
He is one of the few profs that cares about his class.,5.0,positive
nice prof. fair. clear.,4.5,positive
"Great prof, clear and fair...it's Carey!!!",4.5,positive
Best prof I've had!,4.5,positive
Sweet n Sexy: You can feel the chemistry in the air:),5.0,positive
He's just the best... Right,4.0,positive
wicked prof..makes things SO clear..never ever hate chem after this...,4.5,positive
Best chem prof I've ever had! Cynical remarks made it worth getting up for class,5.0,positive
great instructor. very helpful. go to class!,5.0,positive
"""You can convince yourself"" that he's a pretty clear and decent prof overall.",4.0,positive
Intelligent and patient.,5.0,positive
Hardest midterm ever,5.0,positive
"Best tush on campus, keep erasing that blackboard!!",4.0,positive
Science Faculty Head,5.0,positive
His in-class notes are excellent and lectures are very helpful.,4.5,positive
A good teacher over-all but was very rude when asked help outside of class,3.0,neutral
"now, THIS is a good teacher",4.5,positive
The best science prof I've had yet!,5.0,positive
His snide comments are rude and unencouraging.,2.5,negative
"Bissonnette's a machine, one of the best profs out there!",5.0,positive
Please stop inflicting this man on the students.,1.0,negative
"by far the worst prof i've had in all of my undergrad and graduate career. he doesn't care about students, he doesn't care about teaching. he cares about showing how smart he is. instead of explaining material clearly, he will give you the most convoluted content to figure out on your own. and he will call you out for your mistakes publicly.",1.0,negative
"Thought you retired, but you are like the energizer bunny, I shall wait to see the battery run out. OK lets Try 1V instead of 3.3V. Surprising You can function with 0V too.",1.0,negative
Terrible professor,1.0,negative
"One of the few courses I finished and actually felt like I learned something useful. Barby has some issues in his methods (flies through notes yet somehow has time for four lectures of ""Q/A""), and you'll hate him during the term. That is, until you realize he cares more about making us good engineers than passing us with high grades.",5.0,positive
"Puts all other professors i considered bad to shame. Will not hesitate to fail an entire class and will do absolutely nothing to prepare you for the exam. If you manage to pass, be ready to move on from his course having gained zero useful knowledge other than how to deal with incredible stress.",1.0,negative
Pretty bad,1.0,negative
"One of the best professors. He will motivate you to study. He knows the material really well. It was hard to follow his lectures but he gives you a lot of practice problems. This course will prepare you well for future circuit courses. Make sure to do all the assignments, attend tutorials and ask him for help during office hours.",5.0,positive
"One of the best professors I have ever had. At first glance he may seem rough and rude. But it took me a co-op term after the course to understand the worth of what he teaches and why he goes hard on the students. His grading scheme may seem gargantuan but irl, it lets you get 90s easily. Real gem, knows how to make his students good at EE design.",5.0,positive
"""Who let him in the college!? While is he still in the college? When will he leave the college?Why would he let anyone be taught by him in the college? Why would he grade anyone in the college!? "" These are the questions that pop out In my head more than the semester questions....",1.0,negative
Not a good person. Mocks a lot!! Should be give resignation ASAP!,1.0,negative
"I'm sorry but I don't understand why the department in nano eng. dont see why this guy shouldn't be a professor. Maybe he's good at a researcher, but as a lecturer, he's terrible.",1.0,negative
"Arrogant, prone to shouting if mad, simply does not care if you fail. In fact, seems as though he WANTS you to. If you can avoid him, don't just walk away - RUN.",1.0,negative
RUN,1.0,negative
Avoid,1.0,negative
Can't teach anything. None of the students can follow his lectures.,1.0,negative
so useless,1.0,negative
"Associate Professor, Senior Associate Chair Ha Ha Learn to get your self out of a paper bag Ha Ha",1.0,negative
James Barby is a total sick baller OG.,5.0,positive
Difficult course and hard exams but I guarantee you will know how to design circuits after taking this course. Very well taught.,4.5,positive
"Best professor in my opinion. Lectures are challenging but very practical. They guy teaches you stuff which will make your star in the industry. Very approachable. Always help, never says no. Had many office hours to help students. HONEST, SIMPLE and STRAIGHT FORWARD professor. Cares about Students.",3.5,neutral
"Miserable, sad man.",1.0,negative
Terrible professor!!! Made my life miserable. Doesn't explain things from the basis of the concept. Expects us to be scientists. Useless to attend his lectures unless you have a PhD.,2.0,negative
With him leading the ECE department. He screw up the whole school and its students' life along with it. Way to go.,1.0,negative
want to know if you are the best and the brightest in Canada? take his course to find out,1.0,negative
Took his course in Winter 2012 which was guest lectured with Adel Sedra. It was the best course I ever took and regardless of how hard the tutorials midtern and final were Barby knows his stuff. Anyone who says otherwise didn't put in the effort and didn't try. One of the best profs at UW hands down.,4.0,positive
Not a helpful person.,2.5,negative
"When a class midterm average is in the high 20's, and the students attending the class had some of the highest entering grades among all programs in Canada, you know the problem is not the students but the teacher. Many students taking his class were in fear of failing a class for the first time in their life through no fault of their own.",2.0,negative
Hardcore but awesoem guy,5.0,positive
"If you walk in this class with a weak electrical background then you'll definitely find his lectures being useless but for the strong electrical students, he's pretty good. He knows his stuff but cant really teach it in a straight forward way. A good portion of his exams usually consist of VERY similar questions from his practice exams.",2.5,negative
"Hard prof, but wants you to learn the material. Labs are good, but exams are challenging. Will help students",3.5,neutral
Say what you will about Barby he does a good job. Assuming his job is to make you learn the material and learn it well. using fear as a motivative tool. tough love,3.0,neutral
"THE WORST professor of the entire university. he cannot teach, cannot explain material, tests on the most obscure topics. AVOID IF POSSIBLE",1.5,negative
one of the worst profs you will ever meet in your life,1.0,negative
"Aweful, He does not help at all even when you ask for help. And he doesn't care about you, he is constantly power tripping and seems to enjoy sending malicious emails to students for no reason at all.",1.0,negative
Unbelievably bad. Incompetent to the max.,1.0,negative
Very bad professor. He will fail your work for the slightest imperfection and is completely unreasonable. A bitter monkey with a stopwatch and whistle could do a comparable job.,1.0,negative
"This guy hates students. He will tell you how hard you life is going to be, and then laugh about it. He will call you stupid and challenged.",2.5,negative
Jim Barby is the Antichrist and is sustained by the anguish of his students. He will ask 6 questions / min to which no one will know the answers to. You will fail. He will laugh.,1.0,negative
"He has some sort of deep hatred for students of ECE. Himself is a ryerson polytechnic grad so seems to have an inferiority complex. People like him cause VT like incidents. University should get rid of this guy. Worst decision ever to have made him associate chair. For this guy alone, no cent of my money is going to UW as alumni donation/support.",1.0,negative
"Seems like he cares about the students and wants everyone to be engaged and do well. This is evident during lectures and midterm examinations. However, things change before the final exam. Talk about wolf in sheep's clothing... Loves to screw around with his students. Tells us he wont be following the past finals, but then gives us same questions!!",2.0,negative
One word: Saddist,1.0,negative
"Has a rather arrogant attitude when teaching. Not the greatest at explaining, & expects u to learn something after mentioning it once. Dun bother taking notes in class, cause wat he writes doesnt help much; goes too fast to keep up anyways. If u study from past exams & have an idea what to expect, then passing is possible; 13% class avg is normal..",2.5,negative
"Extremely messed up in the head. This man is not afraid to fail the whole class and infact, it seems as if his objective is to actually fail 10-20 students every time. Stay away from this guy. Absolutely horrible man",1.0,negative
"Not as bad as you think he is. At least he is one the few profs in UW engineering who can speak English, however still impossible to understand sometimes.",1.5,negative
"ah gosh I dont know where to start. This man is absolutely horrible creature. He is miserable, without an ounce of humanity. People like him should not be allowed into society. Please do us all and him a favour and kick him out of this otherwise good university. He is a disgrace to all",1.0,negative
"He is a sadist, and simply enjoys torturing students. He is a horrible professor.",3.0,neutral
Jim Barby isn't even an engineer. He got an electronics diploma from Ryerson (when it was a community college) before somehow sneaking into a graduate program at Waterloo. He didn't go through the extremely hard work and extreme rigor of an engineering undergraduate program himself and then he's so hard on people who are. What a hypocrite.,1.0,negative
Jim Barby once badly failed most of a computer engineering class in an analog electronics course. The dept. told him to raise the marks. He refused. The result was most of the class had to repeat the term. Barby is so tough on students like he has something to prove because he didn't even do a bachelor's in engineering himself.,1.0,negative
"He is a great prof that really cares about his students. He doesn't throw you curve balls, its all based on what he's taught.",4.5,positive
"Not sure what this guy does. Can't teach for nuts, the classes were a complete waste of time. The labs were absolutely useless. On an unrelated note, he's written 8 papers in 20 years...not sure what he does with his time (maybe he logs in here and gives himself a couple of good reviews?). Recommend revoking his tenure.",1.0,negative
okok,1.0,negative
"Lectures were next to impossible to follow, because he taught too fast and assumed that you can pick it up in less than a minute. Assignments had no solutions. For pre-labs, people either pulled all-nighters to finish them or simply gave up. We ""flattened"" the lowest midterm avg record completely. Just concentrate on the labs and final to pass.",1.0,negative
Seems to derive a sadistic pleasure form torturing students.,1.0,negative
"Blazes through the course regardless what you say. only 16 people passed midterm. He said it was purely stuff from the assignments, but he never GAVE us the solutions to the assignments. Expects us to know everything and is annoyed when we gave wrong answers to his questions in class.",1.0,negative
"totally useless. He hated us, and we hated him. He tried to fail us all. 23% class midterm average, 16 people pass. Lab TAs clueless, just like prof. Tutorial TA worse.",1.0,negative
Professor Barby is the worst professor I have ever had.,1.0,negative
"Students dislike Barby because he's tough, however: you'll know what he expects and his exams are fair. He also genuinely cares that you UNDERSTAND the material, not that you are happy with your mark. That is what people don't seem to understand.",3.0,neutral
he hates and you and you should do the same,1.0,negative
Reminds me a lot of PDEng....totally useless and a waste of time.,2.5,negative
"Barby is the MAN! He may not be easy, but he knows his stuff. Be respectful and you'll get far.",5.0,positive
"Very tough prof, but very fair. Cannot teach to save his life but tries very hard. If the class demands of him he will give you resources that will make up for his lack of lecture skills. His exams are very fair though. Absolutely no surprises or tricks, and he does do a lot to teach you what to expect.",3.5,neutral
He cannot teach something if his life depended on it. He expects you to know everything. His style of teaching is to ask questions out of which 90% of them cant be answered. He is also a cynic who will not help you whatsoever during the course or exam.,1.5,negative
"Very bad professor. frankly speaking, at least %95 of the class hate him. the 1's ratings in here is too much for him. He is an old baster.",1.0,negative
Hate him hate him HATE HIM..MOST ARROGGANT CREATURE ON EARTH,1.0,negative
No Comments,2.0,negative
"There's been a lot said about him, but Barby is actually a good man. He gets a bad rap because he runs a tight ship and expects results from students, but he likes circuits and teaching and he's a great administrator who's actually on the students' side. For 332, he's been especially good because Sedra writes the exams and sets the lecture pace.",4.0,positive
"Hate this guy.. hate him.. hate him.. hate him. Unfair, unsympathetic,",1.0,negative
No Comments,1.0,negative
Really great prof - very helpful. But sometimes his answers are beyond students' level of understanding. Don't understand why people hates him so much though. It's the course that's horriblely designed - NOT the professor. (HINT: MEMORIZE OLD EXAMS),5.0,positive
"Barby is an example of why a university should not give tenure to its own students. possibly the singularly most horrible teacher in UW. on top of that, it doesn't seem like he does any research either. (check google scholar). One wonders how he spends his time, and why he exists.",1.0,negative
he makes me want to barf...all over his ugly shirts and sweater vests!!!,1.0,negative
"good lecturer, but expects highly of the class. slightly impatient when explaining concepts but very willing to answer questions and provide help. Easy quizzes, hard exams. No assignments and course notes could be clearer but if you pay attention and learn in class, he is not bad la. better than most other profs in UW.",4.5,positive
No Comments,1.5,negative
"Disorganized. Unclear. Can not teach. Horrible lecture notes. Horrible lectures. Just generally a miserable person, because he is a failure.",1.0,negative
"Miserable, horrible, terrible, worst prof I've ever had to deal with. And this is after harder. The guy should not teach.",1.0,negative
My class had a funny little nickname for this guy... what was it again?... oh yes.. it was Satan.,1.5,negative
"A useless waste of money on a absolutely garbage course taught by an utterly pathetic and moronic 'professor'. I didn't do too well in the course, but strangely feel more sorry for this loser than I do for myself.",1.0,negative
"No where near as good as Sedra. He's not a thorough prof, does not give you insight into solving circuits. He does not go in-depth -- you simply do not learn as much as you could with Barby. He didn't even know that a MOSFET with gate and drain shorted is automatically in saturation - that was the day I immediately switched to Sedra's class.",2.5,negative
He likes to fail students. I don't recommend Electrical and Computer Engineering at Waterloo to anyone because of this professor.,1.0,negative
What an asbolutely miserable human being. He purposely goes out of his way to be a jerk. He is unhelpfull and abrasive. He should realize that there are enough people to hate in the world already without his working so hard to give us another! One of the reasons I will NEVER give money to UW!,1.0,negative
one thing to be strict and a hard prof but it's another to be a prick,1.0,negative
The guy knows his stuff but he cant teach it and he cant stop showing off how great he is.,1.0,negative
worst prof ever,1.0,negative
No Comments,1.0,negative
No Comments,1.0,negative
"Tough as hell. Above average notes, but missing examples. Decent explanations, very good at answering questions. Labs unclear, but improving.",4.5,positive
I guess getting****d as a class only brings us closer together... or something like that. Quizzes are impossible. Labs are not pass-able.,1.0,negative
1 out of 5 is too much for him,1.0,negative
< 1/5 would be better,1.0,negative
I wonder what are people like him doing on earth? Just to make other's lives miserable? God! I hate this guy!!,1.0,negative
Barby should honestly be BANNED from teaching. He is truly a disgrace to the faculty of Engineering at Waterloo.,1.0,negative
"low tech lab, obsolete labs, no one use it anymore, inadequate",1.0,negative
I can say without hyperbole that he is the worst professor in the history of the universe times 10.,1.0,negative
GOD SAVE US. HE IS TEACHING AGAIN.,1.0,negative
They only reason they hired this man is to make themselves look good.,1.0,negative
"worst professor in the entire world, entire universe. most hated prof of university of waterloo",1.0,negative
